{"schema_version":"1.0.0","scope":"godot-export","outcome":"PASS","target":"macos-universal2","profile":"release","preset":"macOS Technical","engine_version":"4.7.2.stable.official.ed1daf0bf","artifact":{"path":".gameatelier/artifacts/atelier-20260828t130409.705786000z-d2410b2fe1e4/game-release.zip","media_type":"application/zip","sha256":"03fb441a54f83e8c7606a5d0bde229df6289c2eb63ffbbe3234d694bfca4a695","byte_size":59655625,"unsigned":true,"not_notarized":true,"public_distribution_ready":false,"target_smoke":{"host":"macos","arch":"arm64","mode":"headless-one-frame","exit_code":0}}}
