{"schema_version":"1.0.0","scope":"godot-export","outcome":"PASS","target":"macos-universal2","profile":"debug","preset":"macOS Technical","engine_version":"4.7.2.stable.official.ed1daf0bf","artifact":{"path":".gameatelier/artifacts/atelier-20260828t130330.285799000z-ad5745ce94b3/game-debug.zip","media_type":"application/zip","sha256":"16add9b67a053cbb846093e6a4641bcd898b22c214eedcba99328b62f7fd0537","byte_size":64329953,"unsigned":true,"not_notarized":true,"public_distribution_ready":false,"target_smoke":{"host":"macos","arch":"arm64","mode":"headless-one-frame","exit_code":0}}}
